{
  "schema_version": 1,
  "azure": {
    "graph_base_url": "https://graph.microsoft.com/v1.0"
  },
  "application_filter": {
    "mode": "all",
    "display_name_prefixes": []
  },
  "applications": [
    {
      "id": "my-home-app",
      "managed": false,
      "match": {
        "client_id": "00000000-0000-0000-0000-000000000000",
        "display_name": "My Home App"
      },
      "display_name": "My Home App",
      "sign_in_audience": "AzureADMyOrg",
      "web": {
        "redirect_uris": ["https://app.example.invalid/oauth/callback"]
      },
      "spa": {
        "redirect_uris": []
      },
      "public_client": {
        "redirect_uris": []
      },
      "required_resource_access": [
        {
          "resource_app_id": "00000003-0000-0000-c000-000000000000",
          "resource_access": [
            {
              "id": "e1fe6dd8-ba31-4d61-89e7-88639da4683d",
              "type": "Scope"
            }
          ]
        }
      ],
      "identifier_uris": []
    }
  ]
}
